<?xml version="1.0" encoding="UTF-8"?>
<someRootElement
	xmlns="urn:com:gl:vn:me:ko:pies"
	xmlns:xsi="http://www.w3.org/2001/XMLSchema-instance"
	xsi:schemaLocation="urn:com:gl:vn:me:ko:pies testXmlConfig.xsd">
	<foo>
		<bar>
			<testString>value ð¤§° &#x0064;&#x494F8;</testString>
			<testMultipleOfStrings>value1; value2;
				value1;
				value3;
				valueWithEscaped\;Semicolon
			</testMultipleOfStrings>
			<testInteger>-1</testInteger>
			<testLong>9000000000</testLong>
			<testDouble>1.6E10</testDouble>
			<testBooleanTrue>true</testBooleanTrue>
			<testBooleanFalse>false</testBooleanFalse>
			<testBigInteger>999999999999999999</testBigInteger>
			<testVariableInterpolation>${foo.bar.testBigDecimal}</testVariableInterpolation>
			<testBigDecimal>-0.5E-9999</testBigDecimal>
			<testStringable>a</testStringable>
		</bar>
	</foo>
</someRootElement>